{"$schema":"https://json-schema.org/draft/2020-12/schema","title":"AWA Asset Graph Edge v0.1","description":"","type":"object","required":["contract","edge_id","from","to","type","required","version_constraint","scope","reason","provenance_ref"],"properties":{"contract":{"const":"asset-graph-edge.v0.1"},"edge_id":{"type":"string","minLength":1},"from":{"type":"string","minLength":1},"to":{"type":"string","minLength":1},"type":{"type":"string","enum":["requires","optional","provides","uses","binds","generated_from","derived_from","validated_by","replaces","conflicts","belongs_to","implements"]},"required":{"type":"boolean"},"version_constraint":{"type":["string","null"]},"scope":{"type":"string","enum":["semantic","composition","asset","runtime","presentation","validation"]},"reason":{"type":"string"},"provenance_ref":{"type":"string","minLength":1}},"additionalProperties":false,"$id":"urn:awa:schema:asset-graph-edge-v0-1"}
